{
  "schemaVersion": 1,
  "id": "case008",
  "title": "Piscina cerrada",
  "intro": "Vera fue encontrada sin vida junto a la piscina cerrada. Reconstruye la escena para identificar a quien se quedó a solas con ella.",
  "difficulty": 1,
  "rows": 6,
  "columns": 6,
  "zones": [
    { "id": "pool", "name": "Piscina", "tone": "kitchen", "surface": "tile" },
    { "id": "lockers", "name": "Vestuarios", "tone": "storage", "surface": "tile", "labelAnchor": { "position": { "row": 3, "column": 1 } } },
    { "id": "deck", "name": "Pasarela", "tone": "cafe", "surface": "wood", "labelAnchor": { "position": { "row": 5, "column": 2 } } },
    { "id": "stands", "name": "Gradas", "tone": "bathroom", "surface": "concrete", "labelAnchor": { "position": { "row": 4, "column": 6 } } },
    { "id": "reception", "name": "Recepción", "tone": "cafe", "surface": "tile", "labelAnchor": { "position": { "row": 1, "column": 2 } } }
  ],
  "objects": [
    { "id": "lifeguardChair", "label": "silla de socorrista", "iconAsset": "contextual.object.lifeguard_chair", "occupiable": true, "appearance": "lifeguardChair", "occupiablePositions": [{ "row": 4, "column": 1 }] },
    { "id": "lockerBank", "label": "taquillas", "iconAsset": "contextual.object.locker_bank", "occupiable": false, "appearance": "lockerBank" },
    { "id": "deckSeat", "label": "banco exterior", "iconAsset": "contextual.object.outdoor_bench", "occupiable": true, "appearance": "outdoorBench" },
    { "id": "standSeatA", "label": "silla de comedor", "iconAsset": "contextual.object.dining_chair", "occupiable": true, "appearance": "diningChair" },
    { "id": "standSeatB", "label": "silla de comedor", "iconAsset": "contextual.object.dining_chair", "occupiable": true, "appearance": "diningChair" },
    { "id": "receptionSeat", "label": "taburete", "iconAsset": "contextual.object.stool", "occupiable": true, "appearance": "stool" },
    { "id": "poolSurface", "label": "piscina", "iconAsset": "contextual.object.pool_surface", "occupiable": false, "appearance": "poolSurface", "footprint": { "id": "poolSurface-footprint", "positions": [{ "row": 2, "column": 2 }, { "row": 2, "column": 3 }, { "row": 2, "column": 4 }, { "row": 3, "column": 2 }, { "row": 3, "column": 3 }, { "row": 3, "column": 4 }] }, "occupiablePositions": [] }
  ],
  "board": [
    { "row": 1, "column": 1, "zoneId": "lockers", "occupiable": true },
    { "row": 1, "column": 2, "zoneId": "reception", "occupiable": true },
    { "row": 1, "column": 3, "zoneId": "reception", "occupiable": true },
    { "row": 1, "column": 4, "zoneId": "reception", "occupiable": true, "objectId": "receptionSeat" },
    { "row": 1, "column": 5, "zoneId": "stands", "occupiable": true },
    { "row": 1, "column": 6, "zoneId": "stands", "occupiable": true },
    { "row": 2, "column": 1, "zoneId": "lockers", "occupiable": false, "objectId": "lockerBank" },
    { "row": 2, "column": 2, "zoneId": "pool", "occupiable": false, "objectId": "poolSurface" },
    { "row": 2, "column": 3, "zoneId": "pool", "occupiable": false, "objectId": "poolSurface" },
    { "row": 2, "column": 4, "zoneId": "pool", "occupiable": false, "objectId": "poolSurface" },
    { "row": 2, "column": 5, "zoneId": "stands", "occupiable": true },
    { "row": 2, "column": 6, "zoneId": "stands", "occupiable": true, "objectId": "standSeatA" },
    { "row": 3, "column": 1, "zoneId": "lockers", "occupiable": true },
    { "row": 3, "column": 2, "zoneId": "pool", "occupiable": false, "objectId": "poolSurface" },
    { "row": 3, "column": 3, "zoneId": "pool", "occupiable": false, "objectId": "poolSurface" },
    { "row": 3, "column": 4, "zoneId": "pool", "occupiable": false, "objectId": "poolSurface" },
    { "row": 3, "column": 5, "zoneId": "stands", "occupiable": true, "objectId": "standSeatB" },
    { "row": 3, "column": 6, "zoneId": "stands", "occupiable": true },
    { "row": 4, "column": 1, "zoneId": "deck", "occupiable": true, "objectId": "lifeguardChair" },
    { "row": 4, "column": 2, "zoneId": "deck", "occupiable": true },
    { "row": 4, "column": 3, "zoneId": "reception", "occupiable": true },
    { "row": 4, "column": 4, "zoneId": "reception", "occupiable": true },
    { "row": 4, "column": 5, "zoneId": "stands", "occupiable": true },
    { "row": 4, "column": 6, "zoneId": "stands", "occupiable": true },
    { "row": 5, "column": 1, "zoneId": "deck", "occupiable": true },
    { "row": 5, "column": 2, "zoneId": "deck", "occupiable": true },
    { "row": 5, "column": 3, "zoneId": "reception", "occupiable": true, "objectId": "deckSeat" },
    { "row": 5, "column": 4, "zoneId": "reception", "occupiable": true },
    { "row": 5, "column": 5, "zoneId": "stands", "occupiable": true },
    { "row": 5, "column": 6, "zoneId": "stands", "occupiable": true },
    { "row": 6, "column": 1, "zoneId": "deck", "occupiable": true },
    { "row": 6, "column": 2, "zoneId": "deck", "occupiable": true },
    { "row": 6, "column": 3, "zoneId": "reception", "occupiable": true },
    { "row": 6, "column": 4, "zoneId": "reception", "occupiable": true },
    { "row": 6, "column": 5, "zoneId": "stands", "occupiable": true },
    { "row": 6, "column": 6, "zoneId": "stands", "occupiable": true }
  ],
  "characters": [
    { "id": "sara", "name": "Sara", "avatar": "\ud83d\udc64", "avatarAsset": "avatar.avatar_01", "isVictim": false, "clues": [{ "id": "c08-sara", "type": "onObject", "objectId": "receptionSeat", "text": "Estaba sentada en el taburete de recepción." }] },
    { "id": "pablo", "name": "Pablo", "avatar": "\ud83d\udc64", "avatarAsset": "avatar.avatar_02", "isVictim": false, "clues": [{ "id": "c08-pablo", "type": "onObject", "objectId": "lifeguardChair", "text": "Estaba en la silla del socorrista." }, { "id": "c08-pablo-deck", "type": "zone", "zoneId": "deck", "text": "Estaba en la pasarela." }] },
    { "id": "nico", "name": "Nico", "avatar": "\ud83d\udc64", "avatarAsset": "avatar.avatar_03", "isVictim": false, "clues": [{ "id": "c08-nico", "type": "onObject", "objectId": "standSeatA", "text": "Estaba sentado en las gradas." }] },
    { "id": "ana", "name": "Ana", "avatar": "\ud83d\udc64", "avatarAsset": "avatar.avatar_04", "isVictim": false, "clues": [{ "id": "c08-ana", "type": "onObject", "objectId": "standSeatB", "text": "Estaba sentada junto a la piscina." }] },
    { "id": "leo", "name": "Leo", "avatar": "\ud83d\udc64", "avatarAsset": "avatar.avatar_05", "isVictim": false, "clues": [{ "id": "c08-leo", "type": "onObject", "objectId": "deckSeat", "text": "Estaba sentado en el banco." }] },
    { "id": "vera", "name": "Vera", "avatar": "\ud83d\udc64", "avatarAsset": "avatar.avatar_06", "isVictim": true, "clues": [] }
  ],
  "solution": [
    { "characterId": "sara", "position": { "row": 1, "column": 4 } },
    { "characterId": "pablo", "position": { "row": 4, "column": 1 } },
    { "characterId": "nico", "position": { "row": 2, "column": 6 } },
    { "characterId": "ana", "position": { "row": 3, "column": 5 } },
    { "characterId": "leo", "position": { "row": 5, "column": 3 } },
    { "characterId": "vera", "position": { "row": 6, "column": 2 } }
  ]
}
